{
  "archive": {
    "bytes": 456,
    "format": "ustar+gzip",
    "name": "houseatlas-0.1.0-fixture.1-x86_64-apple-darwin.tar.gz",
    "sha256": "a74d16ecd61ea9870ffb643874f171f870a1cfbef248aeeeeeb7dce6e277e489",
    "unpackedBytes": 388
  },
  "build": {
    "kind": "synthetic-fixture",
    "nativeProfileSha256": "3333333333333333333333333333333333333333333333333333333333333333",
    "node": "26.10.0",
    "npm": "11.19.1",
    "ref": "refs/heads/main",
    "runAttempt": 1,
    "runId": "1",
    "runner": "macos-15-intel",
    "runnerImage": "synthetic",
    "rust": "1.99.0",
    "workflow": ".github/workflows/release-bundle.yml",
    "workflowCommit": "1111111111111111111111111111111111111111",
    "xcodeBuild": "synthetic"
  },
  "compatibility": {
    "backendFrontend": "same-source",
    "codeRollbackCompatible": false,
    "requiredStorageContractSha256": null,
    "resultingStorageContractSha256": null,
    "status": "unqualified",
    "storagePolicy": "preserve-no-migration"
  },
  "components": {
    "backend": {
      "action": "replace",
      "identitySha256": "f053515fc3280400b13a6479193a196670655c31e9a57bf120f584dcdd46f4c6",
      "requiredInstalledSha256": null
    },
    "frontend": {
      "action": "replace",
      "identitySha256": "0194c97e16a851c2addad8cb9ca24fedbde0bdddb0e77eb9ab9f668be3f2be3c",
      "requiredInstalledSha256": null
    }
  },
  "files": [
    {
      "bytes": 32,
      "mode": "0755",
      "path": "bin/houseatlas",
      "sha256": "f053515fc3280400b13a6479193a196670655c31e9a57bf120f584dcdd46f4c6"
    },
    {
      "bytes": 38,
      "mode": "0644",
      "path": "frontend/assets/application.js",
      "sha256": "7d83b8969afd88d4797c4f371e2ad2e7a6d078afebab82de2fe937e045af11a5"
    },
    {
      "bytes": 35,
      "mode": "0644",
      "path": "frontend/index.html",
      "sha256": "9d0a337f19530c259328de206aa26f444ad3d3f33a041e25cee3a66d9ce4738f"
    },
    {
      "bytes": 144,
      "mode": "0644",
      "path": "frontend/saved/index.html",
      "sha256": "dbeb4f0bc58d1128d1c3df8e2dcd2c47a74ed4df1c5a5c19a58fb1867b26b772"
    },
    {
      "bytes": 90,
      "mode": "0644",
      "path": "frontend/saved/service-worker.js",
      "sha256": "acbe524b3d500d39117d0f4fdc138ecf89d88822212b70bbe074a622d740ad05"
    },
    {
      "bytes": 49,
      "mode": "0644",
      "path": "licenses/synthetic-LICENSE.txt",
      "sha256": "ad57f91326dc53093455060676b21318299d6c515ea6a563f12d20b7f45a4201"
    }
  ],
  "format": "houseatlas.release-bundle.v1",
  "frontend": {
    "closureSha256": "0194c97e16a851c2addad8cb9ca24fedbde0bdddb0e77eb9ab9f668be3f2be3c",
    "shellBuildSha256": "aaaaaaaaaaaaaaaaaaaaaaaaaaaaaaaaaaaaaaaaaaaaaaaaaaaaaaaaaaaaaaaa"
  },
  "platform": {
    "abi": "apple-darwin",
    "architecture": "x86_64",
    "dynamicLibraries": [],
    "minimumOs": "15.0",
    "os": "macos",
    "sdkVersion": "15.0",
    "target": "x86_64-apple-darwin"
  },
  "preservedComponents": [
    "updater",
    "configuration",
    "database",
    "access-state",
    "media",
    "models",
    "saved-copies"
  ],
  "runtimeQualification": "not-established",
  "schemaSha256": "421ce99daf71e45df1580cafcc1eb146be1561023059075825fc6b77b2700a0f",
  "source": {
    "commit": "1111111111111111111111111111111111111111",
    "repository": "EzraCerpac/HouseAtlas",
    "tree": "2222222222222222222222222222222222222222"
  },
  "version": "0.1.0-fixture.1"
}
